No,Category,Issue,Keywords,Platform,Description,Do,Don't,Code Example Good,Code Example Bad,Severity
1,Accessibility,Icon Button Labels,icon button aria-label,Web,Icon-only buttons must have accessible names,Add aria-label to icon buttons,Icon button without label,"<button aria-label='Close'><XIcon /></button>","<button><XIcon /></button>",Critical
2,Accessibility,Form Control Labels,form input label aria,Web,All form controls need labels or aria-label,Use label element or aria-label,Input without accessible name,"<label for='email'>Email</label><input id='email' />","<input placeholder='Email' />",Critical
3,Accessibility,Keyboard Handlers,keyboard onclick onkeydown,Web,Interactive elements must support keyboard interaction,Add onKeyDown alongside onClick,Click-only interaction,"<div onClick={fn} onKeyDown={fn} tabIndex={0}>","<div onClick={fn}>",High
4,Accessibility,Semantic HTML,semantic button a label,Web,Use semantic HTML before ARIA attributes,Use button/a/label elements,Div with role attribute,"<button onClick={fn}>Submit</button>","<div role='button' onClick={fn}>Submit</div>",High
5,Accessibility,Aria Live,aria-live polite async,Web,Async updates need aria-live for screen readers,Add aria-live='polite' for dynamic content,Silent async updates,"<div aria-live='polite'>{status}</div>","<div>{status}</div> // no announcement",Medium
6,Accessibility,Decorative Icons,aria-hidden decorative icon,Web,Decorative icons should be hidden from screen readers,Add aria-hidden='true' to decorative icons,Decorative icon announced,"<Icon aria-hidden='true' />","<Icon /> // announced as 'image'",Medium
7,Focus,Visible Focus States,focus-visible outline ring,Web,All interactive elements need visible focus states,Use :focus-visible with ring/outline,No focus indication,"focus-visible:ring-2 focus-visible:ring-blue-500","outline-none // no replacement",Critical
8,Focus,Never Remove Outline,outline-none focus replacement,Web,Never remove outline without providing replacement,Replace outline with visible alternative,Remove outline completely,"focus:outline-none focus:ring-2","focus:outline-none // nothing else",Critical
9,Focus,Checkbox Radio Hit Target,checkbox radio label target,Web,Checkbox/radio must share hit target with label,Wrap input and label together,Separate tiny checkbox,"<label class='flex gap-2'><input type='checkbox' /><span>Option</span></label>","<input type='checkbox' id='x' /><label for='x'>Option</label>",Medium
10,Forms,Autocomplete Attribute,autocomplete input form,Web,Inputs need autocomplete attribute for autofill,Add appropriate autocomplete value,Missing autocomplete,"<input autocomplete='email' type='email' />","<input type='email' />",High
11,Forms,Semantic Input Types,input type email tel url,Web,Use semantic input type attributes,Use email/tel/url/number types,text type for everything,"<input type='email' />","<input type='text' /> // for email",Medium
12,Forms,Never Block Paste,paste onpaste password,Web,Never prevent paste functionality,Allow paste on all inputs,Block paste on password/code,"<input type='password' />","<input onPaste={e => e.preventDefault()} />",High
13,Forms,Spellcheck Disable,spellcheck email code,Web,Disable spellcheck on emails and codes,Set spellcheck='false' on codes,Spellcheck on technical input,"<input spellCheck='false' type='email' />","<input type='email' /> // red squiggles",Low
14,Forms,Submit Button Enabled,submit button disabled loading,Web,Keep submit enabled and show spinner during requests,Show loading spinner keep enabled,Disable button during submit,"<button>{loading ? <Spinner /> : 'Submit'}</button>","<button disabled={loading}>Submit</button>",Medium
15,Forms,Inline Errors,error message inline focus,Web,Show error messages inline near the problem field,Inline error with focus on first error,Single error at top,"<input /><span class='text-red-500'>{error}</span>","<div class='error'>{allErrors}</div> // at top",High
16,Performance,Virtualize Lists,virtualize list 50 items,Web,Virtualize lists exceeding 50 items,Use virtual list for large datasets,Render all items,"<VirtualList items={items} />","items.map(item => <Item />)",High
17,Performance,Avoid Layout Reads,layout read render getboundingclientrect,Web,Avoid layout reads during render phase,Read layout in effects or callbacks,getBoundingClientRect in render,"useEffect(() => { el.getBoundingClientRect() })","const rect = el.getBoundingClientRect() // in render",Medium
18,Performance,Batch DOM Operations,batch dom write read,Web,Group DOM operations to minimize reflows,Batch writes then reads,Interleave reads and writes,"writes.forEach(w => w()); reads.forEach(r => r())","write(); read(); write(); read(); // thrashing",Medium
19,Performance,Preconnect CDN,preconnect link cdn,Web,Add preconnect links for CDN domains,Preconnect to known domains,"<link rel='preconnect' href='https://cdn.example.com' />","// no preconnect hint",Low
20,Performance,Lazy Load Images,lazy loading image below-fold,Web,Lazy-load images below the fold,Use loading='lazy' for below-fold images,Load all images eagerly,"<img loading='lazy' src='...' />","<img src='...' /> // above fold only",Medium
21,State,URL Reflects State,url state query params,Web,URL should reflect current UI state,Sync filters/tabs/pagination to URL,State only in memory,"?tab=settings&page=2","useState only // lost on refresh",High
22,State,Deep Linking,deep link stateful component,Web,Stateful components should support deep-linking,Enable sharing current view via URL,No shareable state,"router.push({ query: { ...filters } })","setFilters(f) // not in URL",Medium
23,State,Confirm Destructive Actions,confirm destructive delete modal,Web,Destructive actions require confirmation,Show confirmation dialog before delete,Delete without confirmation,"if (confirm('Delete?')) delete()","onClick={delete} // no confirmation",High
24,Typography,Proper Unicode,unicode ellipsis quotes,Web,Use proper Unicode characters,Use ... curly quotes proper dashes,ASCII approximations,"'Hello...' with proper ellipsis","'Hello...' with three dots",Low
25,Typography,Text Overflow,truncate line-clamp overflow,Web,Handle text overflow properly,Use truncate/line-clamp/break-words,Text overflows container,"<p class='truncate'>Long text...</p>","<p>Long text...</p> // overflows",Medium
26,Typography,Non-Breaking Spaces,nbsp unit brand,Web,Use non-breaking spaces for units and brand names,Use &nbsp; between number and unit,"10&nbsp;kg or Next.js&nbsp;14","10 kg // may wrap",Low
27,Anti-Pattern,No Zoom Disable,viewport zoom disable,Web,Never disable zoom in viewport meta,Allow user zoom,"<meta name='viewport' content='width=device-width'>","<meta name='viewport' content='maximum-scale=1'>",Critical
28,Anti-Pattern,No Transition All,transition all specific,Web,Avoid transition: all - specify properties,Transition specific properties,transition: all,"transition-colors duration-200","transition-all duration-200",Medium
29,Anti-Pattern,Outline Replacement,outline-none ring focus,Web,Never use outline-none without replacement,Provide visible focus replacement,Remove outline with nothing,"focus:outline-none focus:ring-2 focus:ring-blue-500","focus:outline-none // alone",Critical
30,Anti-Pattern,No Hardcoded Dates,date format intl locale,Web,Use Intl for date/number formatting,Use Intl.DateTimeFormat,Hardcoded date format,"new Intl.DateTimeFormat('en').format(date)","date.toLocaleDateString() // or manual format",Medium
31,Pricing,Usage-Based Transparency,"usage based pricing, ubp, transparency",SaaS,"Pricing pages must transparently display usage metrics and costs to build trust for consumption-based models.","Include clear cost-per-unit metrics and spending caps; link to usage dashboards.",Hidden fees or ambiguous "contact sales" for basic usage.,"<div class='usage-pricing'>$0.05 per 1k tokens <a href='/calculator'>Estimate Cost</a></div>","<div class='pricing'>Contact for pricing</div>",High
32,Pricing,Interactive ROI Calculator,"pricing calculator, roi, interactive",SaaS,"Interactive tools allowing users to estimate costs based on their specific usage scenarios.","Use sliders/inputs for key metrics (users, storage, API calls) to auto-calculate estimated monthly cost.",Static pricing tables for complex usage models.,"<Calculator inputs={['Users', 'Storage']} rate={0.5} />","<table><tr><td>1-10 Users</td><td>$100</td></tr></table>",Medium
33,Pricing,Billing Frequency Toggle,"monthly annual toggle, pricing switch",SaaS,"Allow users to easily switch between monthly and annual billing views to see savings.","Use a toggle switch with clear 'Save 20%' badges for annual plans.",Separate pages for monthly vs annual pricing.,"<Toggle label='Annual (Save 20%)' checked={isAnnual} onChange={toggle} />","<a href='/pricing/annual'>View Annual Plans</a>",High
34,Pricing,Comparison Matrix Efficiency,"comparison table, feature matrix",SaaS,"Detailed breakdown of features across plans, often using collapsible sections or tooltips to avoid clutter.","Use sticky headers for plan names; collapsable categories for long lists.",Overwhelming grids without categorization.,"<Table stickyHeader><Category title='Core Features' collapsed={false} />...</Table>","<Table><thead>...</thead><tbody>...100 rows...</tbody></Table>",Medium
35,Footer,Grid Layout Structure,"footer grid, layout organization",Web,"Organize footer links into clear, responsive grid columns for readability and navigation efficiency.","Use CSS Grid with 4-5 columns for desktop, collapsing to 1-2 for mobile.",Unstructured lists or center-aligned chaotic links.,"<footer class='grid cols-4 gap-8'><div>Product</div><div>Company</div>...</footer>","<footer class='text-center'><a href='#'>Link</a> <a href='#'>Link</a>...</footer>",High
36,Footer,Strategic Micro-Navigation,"footer navigation, secondary nav",Web,"Curated lists of important but secondary links (e.g., 'Popular Resources', 'User Personas') to guide users who reached the bottom.","Group links by user intent or popularity; include a 'Back to Top' button.",Repeating the entire header navigation or dumping all site map links.,"<div class='footer-nav'><h4>For Developers</h4><a href='/docs'>API</a>...</div>","<div class='footer-nav'><a href='/home'>Home</a>... (duplicate of header)</div>",Medium
37,Footer,Decision Zone CTA,"footer cta, conversion zone",Web,"A final call-to-action area just above or within the footer to capture users who have scrolled through the entire page.","Place a prominent 'Start Free Trial' or 'Contact Us' section before the legal footer.",Burying the CTA in fine print or omitting it entirely at the bottom.,"<div class='pre-footer-cta'><h2>Ready to build?</h2><Button>Get Started</Button></div>","<footer>...Copyright 2026...</footer> (no CTA)",High
38,Footer,Legal & Compliance Layer,"footer legal, copyright, privacy",Web,"Clearly separated section for copyright, privacy policy, terms of service, and accessibility statements.","Visually distinct (smaller text/lower contrast) row at the very bottom; ensure accessibility links are present.",Mixing legal links with navigation links randomly.,"<div class='legal-row'><span>&copy; 2026</span> <a href='/privacy'>Privacy</a></div>","<footer><a href='/product'>Product</a> <a href='/privacy'>Privacy</a></footer>",Critical
